{
  "$schema": "https://decantr.ai/schemas/section-pack.v1.json",
  "packVersion": "1.0.0",
  "packType": "section",
  "objective": "Implement the registry-browser section using the compiled top-nav-main shell contract.",
  "target": {
    "platform": "web",
    "framework": "nextjs",
    "runtime": "spa",
    "adapter": "nextjs"
  },
  "preset": null,
  "scope": {
    "appId": "app",
    "pageIds": [
      "homepage",
      "browse",
      "browse-type",
      "detail",
      "profile"
    ],
    "patternIds": [
      "blueprint-launch-hero",
      "search-filter-bar",
      "featured-launchpad-list",
      "launchpad-flow",
      "registry-link-list",
      "content-card-grid",
      "command-rail",
      "blueprint-anatomy",
      "contract-explorer",
      "json-viewer",
      "detail-header",
      "activity-feed"
    ]
  },
  "requiredSetup": [
    "Use the declared section routes as the source of truth for this slice of the app.",
    "Keep the section shell consistent unless the task explicitly changes the shell contract."
  ],
  "allowedVocabulary": [
    "registry-browser",
    "primary",
    "top-nav-main",
    "luminarum",
    "dark",
    "search",
    "pagination",
    "blueprint-launch-hero",
    "search-filter-bar",
    "featured-launchpad-list",
    "launchpad-flow",
    "registry-link-list",
    "content-card-grid",
    "command-rail",
    "blueprint-anatomy",
    "contract-explorer",
    "json-viewer",
    "detail-header",
    "activity-feed"
  ],
  "examples": [],
  "antiPatterns": [],
  "successChecks": [
    {
      "id": "section-route-coherence",
      "label": "Section pages and routes remain coherent with the compiled topology.",
      "severity": "error"
    },
    {
      "id": "section-shell-consistency",
      "label": "The section shell contract stays consistent across its routes.",
      "severity": "error"
    },
    {
      "id": "section-pattern-coverage",
      "label": "Primary section patterns are represented without adding off-contract filler sections.",
      "severity": "warn"
    }
  ],
  "tokenBudget": {
    "target": 1400,
    "max": 2200,
    "strategy": [
      "Prefer route summaries over repeated prose.",
      "Use compact vocabulary lists instead of large reference tables.",
      "Include only task-relevant examples and checks."
    ]
  },
  "data": {
    "sectionId": "registry-browser",
    "role": "primary",
    "shell": "top-nav-main",
    "description": "Public content browsing for a design registry. Search, filter, and explore patterns, themes, blueprints, archetypes, and shells.",
    "features": [
      "search",
      "pagination"
    ],
    "theme": {
      "id": "luminarum",
      "mode": "dark",
      "shape": "rounded"
    },
    "routes": [
      {
        "pageId": "homepage",
        "sectionId": "registry-browser",
        "path": "/",
        "patternIds": [
          "blueprint-launch-hero",
          "search-filter-bar",
          "featured-launchpad-list",
          "launchpad-flow",
          "registry-link-list"
        ],
        "shell": "top-nav-main"
      },
      {
        "pageId": "browse",
        "sectionId": "registry-browser",
        "path": "/browse",
        "patternIds": [
          "search-filter-bar",
          "content-card-grid"
        ],
        "shell": "top-nav-main"
      },
      {
        "pageId": "browse-type",
        "sectionId": "registry-browser",
        "path": "/browse/:type",
        "patternIds": [
          "search-filter-bar",
          "content-card-grid"
        ],
        "shell": "top-nav-main"
      },
      {
        "pageId": "detail",
        "sectionId": "registry-browser",
        "path": "/:type/:namespace/:slug",
        "patternIds": [
          "blueprint-launch-hero",
          "command-rail",
          "blueprint-anatomy",
          "contract-explorer",
          "json-viewer"
        ],
        "shell": "top-nav-main"
      },
      {
        "pageId": "profile",
        "sectionId": "registry-browser",
        "path": "/profile/:username",
        "patternIds": [
          "detail-header",
          "content-card-grid",
          "activity-feed"
        ],
        "shell": "top-nav-main"
      }
    ]
  },
  "renderedMarkdown": "# Section Pack\n\n**Objective:** Implement the registry-browser section using the compiled top-nav-main shell contract.\n**Target:** nextjs (nextjs)\n**Scope:** pages=homepage, browse, browse-type, detail, profile | patterns=blueprint-launch-hero, search-filter-bar, featured-launchpad-list, launchpad-flow, registry-link-list, content-card-grid, command-rail, blueprint-anatomy, contract-explorer, json-viewer, detail-header, activity-feed\n\n## Section Contract\n- Section: registry-browser\n- Role: primary\n- Shell: top-nav-main\n- Theme: luminarum (dark)\n- Features: search, pagination\n- Description: Public content browsing for a design registry. Search, filter, and explore patterns, themes, blueprints, archetypes, and shells.\n\n## Section Routes\n- / -> registry-browser/homepage @ top-nav-main [blueprint-launch-hero, search-filter-bar, featured-launchpad-list, launchpad-flow, registry-link-list]\n- /browse -> registry-browser/browse @ top-nav-main [search-filter-bar, content-card-grid]\n- /browse/:type -> registry-browser/browse-type @ top-nav-main [search-filter-bar, content-card-grid]\n- /:type/:namespace/:slug -> registry-browser/detail @ top-nav-main [blueprint-launch-hero, command-rail, blueprint-anatomy, contract-explorer, json-viewer]\n- /profile/:username -> registry-browser/profile @ top-nav-main [detail-header, content-card-grid, activity-feed]\n\n## Theme Decorators\n\nTheme `luminarum` decorators are documented ONCE in `scaffold-pack.md` under \"Required Theme Decorators\". Apply them across this section's pages — the contract is the same project-wide. See also DECANTR.md \"Decorator Quick Reference\" for the same table.\n\n## Required Setup\n- Use the declared section routes as the source of truth for this slice of the app.\n- Keep the section shell consistent unless the task explicitly changes the shell contract.\n\n## Allowed Vocabulary\n- registry-browser\n- primary\n- top-nav-main\n- luminarum\n- dark\n- search\n- pagination\n- blueprint-launch-hero\n- search-filter-bar\n- featured-launchpad-list\n- launchpad-flow\n- registry-link-list\n- content-card-grid\n- command-rail\n- blueprint-anatomy\n- contract-explorer\n- json-viewer\n- detail-header\n- activity-feed\n\n## Success Checks\n- Section pages and routes remain coherent with the compiled topology. [error]\n- The section shell contract stays consistent across its routes. [error]\n- Primary section patterns are represented without adding off-contract filler sections. [warn]\n\n## Token Budget\n- Target: 1400\n- Max: 2200\n- Prefer route summaries over repeated prose.\n- Use compact vocabulary lists instead of large reference tables.\n- Include only task-relevant examples and checks.\n"
}
