{
  "$schema": "https://decantr.ai/schemas/section-pack.v1.json",
  "packVersion": "1.0.0",
  "packType": "section",
  "objective": "Implement the launch-campaign section using the compiled full-bleed shell contract.",
  "target": {
    "platform": "web",
    "framework": "react",
    "runtime": "spa",
    "adapter": "react-vite"
  },
  "preset": null,
  "scope": {
    "appId": "app",
    "pageIds": [
      "home",
      "rewards",
      "updates",
      "story",
      "demo",
      "checkout",
      "thanks",
      "press"
    ],
    "patternIds": [
      "campaign-marquee-hero",
      "backer-progress-console",
      "prototype-demo-bezel",
      "product-box-spec-panel",
      "reward-tier-selector",
      "stretch-goal-ladder",
      "founder-comic-strip",
      "backer-wall-ticker",
      "continue-screen-cta",
      "launch-update-log",
      "pledge-checkout-panel",
      "share-quest-panel",
      "press-kit-shelf"
    ]
  },
  "requiredSetup": [
    "Use the declared section routes as the source of truth for this slice of the app.",
    "Keep the section shell consistent unless the task explicitly changes the shell contract."
  ],
  "allowedVocabulary": [
    "launch-campaign",
    "public",
    "full-bleed",
    "retro-arcade",
    "dark",
    "marketing",
    "seo",
    "analytics",
    "conversion",
    "campaign-progress",
    "reward-tiers",
    "preorder",
    "waitlist",
    "referrals",
    "press-kit",
    "updates",
    "checkout",
    "campaign-marquee-hero",
    "backer-progress-console",
    "prototype-demo-bezel",
    "product-box-spec-panel",
    "reward-tier-selector",
    "stretch-goal-ladder",
    "founder-comic-strip",
    "backer-wall-ticker",
    "continue-screen-cta",
    "launch-update-log",
    "pledge-checkout-panel",
    "share-quest-panel",
    "press-kit-shelf"
  ],
  "examples": [],
  "antiPatterns": [],
  "successChecks": [
    {
      "id": "section-route-coherence",
      "label": "Section pages and routes remain coherent with the compiled topology.",
      "severity": "error"
    },
    {
      "id": "section-shell-consistency",
      "label": "The section shell contract stays consistent across its routes.",
      "severity": "error"
    },
    {
      "id": "section-pattern-coverage",
      "label": "Primary section patterns are represented without adding off-contract filler sections.",
      "severity": "warn"
    }
  ],
  "tokenBudget": {
    "target": 1400,
    "max": 2200,
    "strategy": [
      "Prefer route summaries over repeated prose.",
      "Use compact vocabulary lists instead of large reference tables.",
      "Include only task-relevant examples and checks."
    ]
  },
  "data": {
    "sectionId": "launch-campaign",
    "role": "public",
    "shell": "full-bleed",
    "description": "Public product-launch funnel for campaign-style launches, preorders, waitlists, crowdfunding-inspired reward tiers, product demos, maker stories, updates, checkout, press assets, and post-conversion sharing.",
    "features": [
      "marketing",
      "seo",
      "analytics",
      "conversion",
      "campaign-progress",
      "reward-tiers",
      "preorder",
      "waitlist",
      "referrals",
      "press-kit",
      "updates",
      "checkout"
    ],
    "theme": {
      "id": "retro-arcade",
      "mode": "dark",
      "shape": "sharp"
    },
    "routes": [
      {
        "pageId": "home",
        "sectionId": "launch-campaign",
        "path": "/",
        "patternIds": [
          "campaign-marquee-hero",
          "backer-progress-console",
          "prototype-demo-bezel",
          "product-box-spec-panel",
          "reward-tier-selector",
          "stretch-goal-ladder",
          "founder-comic-strip",
          "backer-wall-ticker",
          "continue-screen-cta"
        ],
        "shell": "full-bleed"
      },
      {
        "pageId": "rewards",
        "sectionId": "launch-campaign",
        "path": "/rewards",
        "patternIds": [
          "reward-tier-selector",
          "product-box-spec-panel",
          "backer-progress-console",
          "continue-screen-cta"
        ],
        "shell": "full-bleed"
      },
      {
        "pageId": "updates",
        "sectionId": "launch-campaign",
        "path": "/updates",
        "patternIds": [
          "launch-update-log",
          "backer-progress-console",
          "continue-screen-cta"
        ],
        "shell": "full-bleed"
      },
      {
        "pageId": "story",
        "sectionId": "launch-campaign",
        "path": "/story",
        "patternIds": [
          "founder-comic-strip",
          "product-box-spec-panel",
          "continue-screen-cta"
        ],
        "shell": "full-bleed"
      },
      {
        "pageId": "demo",
        "sectionId": "launch-campaign",
        "path": "/demo",
        "patternIds": [
          "prototype-demo-bezel",
          "product-box-spec-panel",
          "continue-screen-cta"
        ],
        "shell": "full-bleed"
      },
      {
        "pageId": "checkout",
        "sectionId": "launch-campaign",
        "path": "/checkout",
        "patternIds": [
          "pledge-checkout-panel"
        ],
        "shell": "full-bleed"
      },
      {
        "pageId": "thanks",
        "sectionId": "launch-campaign",
        "path": "/thanks",
        "patternIds": [
          "continue-screen-cta",
          "share-quest-panel",
          "backer-wall-ticker"
        ],
        "shell": "full-bleed"
      },
      {
        "pageId": "press",
        "sectionId": "launch-campaign",
        "path": "/press",
        "patternIds": [
          "press-kit-shelf",
          "product-box-spec-panel"
        ],
        "shell": "full-bleed"
      }
    ]
  },
  "renderedMarkdown": "# Section Pack\n\n**Objective:** Implement the launch-campaign section using the compiled full-bleed shell contract.\n**Target:** react-vite (react)\n**Scope:** pages=home, rewards, updates, story, demo, checkout, thanks, press | patterns=campaign-marquee-hero, backer-progress-console, prototype-demo-bezel, product-box-spec-panel, reward-tier-selector, stretch-goal-ladder, founder-comic-strip, backer-wall-ticker, continue-screen-cta, launch-update-log, pledge-checkout-panel, share-quest-panel, press-kit-shelf\n\n## Section Contract\n- Section: launch-campaign\n- Role: public\n- Shell: full-bleed\n- Theme: retro-arcade (dark)\n- Features: marketing, seo, analytics, conversion, campaign-progress, reward-tiers, preorder, waitlist, referrals, press-kit, updates, checkout\n- Description: Public product-launch funnel for campaign-style launches, preorders, waitlists, crowdfunding-inspired reward tiers, product demos, maker stories, updates, checkout, press assets, and post-conversion sharing.\n\n## Section Routes\n- / -> launch-campaign/home @ full-bleed [campaign-marquee-hero, backer-progress-console, prototype-demo-bezel, product-box-spec-panel, reward-tier-selector, stretch-goal-ladder, founder-comic-strip, backer-wall-ticker, continue-screen-cta]\n- /rewards -> launch-campaign/rewards @ full-bleed [reward-tier-selector, product-box-spec-panel, backer-progress-console, continue-screen-cta]\n- /updates -> launch-campaign/updates @ full-bleed [launch-update-log, backer-progress-console, continue-screen-cta]\n- /story -> launch-campaign/story @ full-bleed [founder-comic-strip, product-box-spec-panel, continue-screen-cta]\n- /demo -> launch-campaign/demo @ full-bleed [prototype-demo-bezel, product-box-spec-panel, continue-screen-cta]\n- /checkout -> launch-campaign/checkout @ full-bleed [pledge-checkout-panel]\n- /thanks -> launch-campaign/thanks @ full-bleed [continue-screen-cta, share-quest-panel, backer-wall-ticker]\n- /press -> launch-campaign/press @ full-bleed [press-kit-shelf, product-box-spec-panel]\n\n## Theme Decorators\n\nTheme `retro-arcade` decorators are documented ONCE in `scaffold-pack.md` under \"Required Theme Decorators\". Apply them across this section's pages — the contract is the same project-wide. See also DECANTR.md \"Decorator Quick Reference\" for the same table.\n\n## Required Setup\n- Use the declared section routes as the source of truth for this slice of the app.\n- Keep the section shell consistent unless the task explicitly changes the shell contract.\n\n## Allowed Vocabulary\n- launch-campaign\n- public\n- full-bleed\n- retro-arcade\n- dark\n- marketing\n- seo\n- analytics\n- conversion\n- campaign-progress\n- reward-tiers\n- preorder\n- waitlist\n- referrals\n- press-kit\n- updates\n- checkout\n- campaign-marquee-hero\n- backer-progress-console\n- prototype-demo-bezel\n- product-box-spec-panel\n- reward-tier-selector\n- stretch-goal-ladder\n- founder-comic-strip\n- backer-wall-ticker\n- continue-screen-cta\n- launch-update-log\n- pledge-checkout-panel\n- share-quest-panel\n- press-kit-shelf\n\n## Success Checks\n- Section pages and routes remain coherent with the compiled topology. [error]\n- The section shell contract stays consistent across its routes. [error]\n- Primary section patterns are represented without adding off-contract filler sections. [warn]\n\n## Token Budget\n- Target: 1400\n- Max: 2200\n- Prefer route summaries over repeated prose.\n- Use compact vocabulary lists instead of large reference tables.\n- Include only task-relevant examples and checks.\n"
}
