{
  "$schema": "https://decantr.ai/schemas/section-pack.v1.json",
  "packVersion": "1.0.0",
  "packType": "section",
  "objective": "Implement the admin-moderation section using the compiled sidebar-main shell contract.",
  "target": {
    "platform": "web",
    "framework": "nextjs",
    "runtime": "ssr",
    "adapter": "nextjs"
  },
  "preset": null,
  "scope": {
    "appId": "app",
    "pageIds": [
      "moderation-queue",
      "commercial-reports",
      "organizations",
      "organization-detail",
      "moderation-detail",
      "telemetry",
      "telemetry-usage"
    ],
    "patternIds": [
      "search-filter-bar",
      "moderation-queue-item",
      "kpi-grid",
      "activity-feed",
      "content-card-grid",
      "detail-header",
      "content-detail-hero",
      "json-viewer"
    ]
  },
  "requiredSetup": [
    "Use the declared section routes as the source of truth for this slice of the app.",
    "Keep the section shell consistent unless the task explicitly changes the shell contract."
  ],
  "allowedVocabulary": [
    "admin-moderation",
    "auxiliary",
    "sidebar-main",
    "luminarum",
    "dark",
    "auth",
    "admin",
    "search-filter-bar",
    "moderation-queue-item",
    "kpi-grid",
    "activity-feed",
    "content-card-grid",
    "detail-header",
    "content-detail-hero",
    "json-viewer"
  ],
  "examples": [],
  "antiPatterns": [],
  "successChecks": [
    {
      "id": "section-route-coherence",
      "label": "Section pages and routes remain coherent with the compiled topology.",
      "severity": "error"
    },
    {
      "id": "section-shell-consistency",
      "label": "The section shell contract stays consistent across its routes.",
      "severity": "error"
    },
    {
      "id": "section-pattern-coverage",
      "label": "Primary section patterns are represented without adding off-contract filler sections.",
      "severity": "warn"
    }
  ],
  "tokenBudget": {
    "target": 1400,
    "max": 2200,
    "strategy": [
      "Prefer route summaries over repeated prose.",
      "Use compact vocabulary lists instead of large reference tables.",
      "Include only task-relevant examples and checks."
    ]
  },
  "data": {
    "sectionId": "admin-moderation",
    "role": "auxiliary",
    "shell": "sidebar-main",
    "description": "Admin moderation queue for reviewing, approving, and rejecting community-submitted registry content.",
    "features": [
      "auth",
      "admin"
    ],
    "theme": {
      "id": "luminarum",
      "mode": "dark",
      "shape": "rounded"
    },
    "routes": [
      {
        "pageId": "moderation-queue",
        "sectionId": "admin-moderation",
        "path": "/admin/moderation",
        "patternIds": [
          "search-filter-bar",
          "moderation-queue-item"
        ],
        "shell": "sidebar-main"
      },
      {
        "pageId": "commercial-reports",
        "sectionId": "admin-moderation",
        "path": "/admin/reports",
        "patternIds": [
          "kpi-grid",
          "activity-feed"
        ],
        "shell": "sidebar-main"
      },
      {
        "pageId": "organizations",
        "sectionId": "admin-moderation",
        "path": "/admin/organizations",
        "patternIds": [
          "search-filter-bar",
          "content-card-grid",
          "activity-feed"
        ],
        "shell": "sidebar-main"
      },
      {
        "pageId": "organization-detail",
        "sectionId": "admin-moderation",
        "path": "/admin/organizations/:slug",
        "patternIds": [
          "detail-header",
          "kpi-grid",
          "activity-feed",
          "content-card-grid"
        ],
        "shell": "sidebar-main"
      },
      {
        "pageId": "moderation-detail",
        "sectionId": "admin-moderation",
        "path": "/admin/moderation/:id",
        "patternIds": [
          "content-detail-hero",
          "json-viewer",
          "moderation-queue-item"
        ],
        "shell": "sidebar-main"
      },
      {
        "pageId": "telemetry",
        "sectionId": "admin-moderation",
        "path": "/admin/telemetry",
        "patternIds": [
          "kpi-grid",
          "search-filter-bar",
          "activity-feed"
        ],
        "shell": "sidebar-main"
      },
      {
        "pageId": "telemetry-usage",
        "sectionId": "admin-moderation",
        "path": "/admin/telemetry/usage",
        "patternIds": [
          "kpi-grid",
          "activity-feed",
          "content-card-grid"
        ],
        "shell": "sidebar-main"
      }
    ]
  },
  "renderedMarkdown": "# Section Pack\n\n**Objective:** Implement the admin-moderation section using the compiled sidebar-main shell contract.\n**Target:** nextjs (nextjs)\n**Scope:** pages=moderation-queue, commercial-reports, organizations, organization-detail, moderation-detail, telemetry, telemetry-usage | patterns=search-filter-bar, moderation-queue-item, kpi-grid, activity-feed, content-card-grid, detail-header, content-detail-hero, json-viewer\n\n## Section Contract\n- Section: admin-moderation\n- Role: auxiliary\n- Shell: sidebar-main\n- Theme: luminarum (dark)\n- Features: auth, admin\n- Description: Admin moderation queue for reviewing, approving, and rejecting community-submitted registry content.\n\n## Section Routes\n- /admin/moderation -> admin-moderation/moderation-queue @ sidebar-main [search-filter-bar, moderation-queue-item]\n- /admin/reports -> admin-moderation/commercial-reports @ sidebar-main [kpi-grid, activity-feed]\n- /admin/organizations -> admin-moderation/organizations @ sidebar-main [search-filter-bar, content-card-grid, activity-feed]\n- /admin/organizations/:slug -> admin-moderation/organization-detail @ sidebar-main [detail-header, kpi-grid, activity-feed, content-card-grid]\n- /admin/moderation/:id -> admin-moderation/moderation-detail @ sidebar-main [content-detail-hero, json-viewer, moderation-queue-item]\n- /admin/telemetry -> admin-moderation/telemetry @ sidebar-main [kpi-grid, search-filter-bar, activity-feed]\n- /admin/telemetry/usage -> admin-moderation/telemetry-usage @ sidebar-main [kpi-grid, activity-feed, content-card-grid]\n\n## Theme Decorators\n\nTheme `luminarum` decorators are documented ONCE in `scaffold-pack.md` under \"Required Theme Decorators\". Apply them across this section's pages — the contract is the same project-wide. See also DECANTR.md \"Decorator Quick Reference\" for the same table.\n\n## Required Setup\n- Use the declared section routes as the source of truth for this slice of the app.\n- Keep the section shell consistent unless the task explicitly changes the shell contract.\n\n## Allowed Vocabulary\n- admin-moderation\n- auxiliary\n- sidebar-main\n- luminarum\n- dark\n- auth\n- admin\n- search-filter-bar\n- moderation-queue-item\n- kpi-grid\n- activity-feed\n- content-card-grid\n- detail-header\n- content-detail-hero\n- json-viewer\n\n## Success Checks\n- Section pages and routes remain coherent with the compiled topology. [error]\n- The section shell contract stays consistent across its routes. [error]\n- Primary section patterns are represented without adding off-contract filler sections. [warn]\n\n## Token Budget\n- Target: 1400\n- Max: 2200\n- Prefer route summaries over repeated prose.\n- Use compact vocabulary lists instead of large reference tables.\n- Include only task-relevant examples and checks.\n"
}
